Title,DOI,Citations
Multi-lingual Entity Discovery and Linking,10.18653/v1/P18-5008,2
Identifying Key Sentences for Precision Oncology Using Semi-Supervised Learning,10.18653/v1/W18-2305,2
Sense-Aware Neural Models for Pun Location in Texts,10.18653/v1/P18-2087,2
Unsupervised Learning of Style-sensitive Word Vectors,10.18653/v1/P18-2091,2
Multi-Relational Question Answering from Narratives: Machine Reading and Reasoning in Simulated Worlds,10.18653/v1/P18-1077,1
Extrofitting: Enriching Word Representation and its Vector Space with Semantic Lexicons,10.18653/v1/W18-3003,1
Towards one-shot learning for rare-word translation with external experts,10.18653/v1/W18-2712,1
Syntax Helps ELMo Understand Semantics: Is Syntax Still Relevant in a Deep Neural Architecture for SRL?,10.18653/v1/W18-2904,1
"Constraining MGbank: Agreement, L-Selection and Supertagging in Minimalist Grammars",10.18653/v1/P18-1055,1
A Spatial Model for Extracting and Visualizing Latent Discourse Structure in Text,10.18653/v1/P18-1211,1
Backpropagating through Structured Argmax using a SPIGOT,10.18653/v1/P18-1173,1
Countering Position Bias in Instructor Interventions in MOOC Discussion Forums,10.18653/v1/W18-3720,1
A Framework for Representing Language Acquisition in a Population Setting,10.18653/v1/P18-1106,1
From Fidelity to Fluency: Natural Language Processing for Translator Training,10.18653/v1/W18-3719,1
Linear-time Constituency Parsing with RNNs and Dynamic Programming,10.18653/v1/P18-2076,1
Improving Neural Network Performance by Injecting Background Knowledge: Detecting Code-switching and Borrowing in Algerian texts,10.18653/v1/W18-3203,1
From Credit Assignment to Entropy Regularization: Two New Algorithms for Neural Sequence Prediction,10.18653/v1/P18-1155,1
Accommodation of Conversational Code-Choice,10.18653/v1/W18-3210,1
Assessment of an Index for Measuring Pronunciation Difficulty,10.18653/v1/W18-3717,1
A Hybrid Approach Combining Statistical Knowledge with Conditional Random Fields for Chinese Grammatical Error Detection,10.18653/v1/W18-3728,1
Syntactic and Lexical Approaches to Reading Comprehension,10.18653/v1/W18-3702,1
Discovering Implicit Knowledge with Unary Relations,10.18653/v1/P18-1147,1
Learning Cross-lingual Distributed Logical Representations for Semantic Parsing,10.18653/v1/P18-2107,1
Joint learning of frequency and word embeddings for multilingual readability assessment,10.18653/v1/W18-3714,1
Learning Prototypical Goal Activities for Locations,10.18653/v1/P18-1120,1
The OSU Realizer for SRST ‘18: Neural Sequence-to-Sequence Inflection and Incremental Locality-Based Linearization,10.18653/v1/W18-3605,1
Platforms for Non-speakers Annotating Names in Any Language,10.18653/v1/P18-4001,1
Investigating Effective Parameters for Fine-tuning of Word Embeddings Using Only a Small Corpus,10.18653/v1/W18-3408,1
Limitations of Cross-Lingual Learning from Image Search,10.18653/v1/W18-3021,1
Comparison of Representations of Named Entities for Document Classification,10.18653/v1/W18-3008,1
Predicting Japanese Word Order in Double Object Constructions,10.18653/v1/W18-2805,1
Speeding up Context-based Sentence Representation Learning with Non-autoregressive Convolutional Decoding,10.18653/v1/W18-3009,1
Language Production Dynamics with Recurrent Neural Networks,10.18653/v1/W18-2803,1
Do Speakers Produce Discourse Connectives Rationally?,10.18653/v1/W18-2802,1
Predicting Brain Activation with WordNet Embeddings,10.18653/v1/W18-2801,1
Semi-Supervised Learning with Auxiliary Evaluation Component for Large Scale e-Commerce Text Classification,10.18653/v1/W18-3409,1
Low-rank passthrough neural networks,10.18653/v1/W18-3410,1
SingleCite: Towards an improved Single Citation Search in PubMed,10.18653/v1/W18-2318,1
Language Generation via DAG Transduction,10.18653/v1/P18-1179,1
Predicting Discharge Disposition Using Patient Complaint Notes in Electronic Medical Records,10.18653/v1/W18-2316,1
Generating High-Quality Surface Realizations Using Data Augmentation and Factored Sequence Models,10.18653/v1/W18-3606,1
Phrase2VecGLM: Neural generalized language model–based semantic tagging for complex query reformulation in medical IR,10.18653/v1/W18-2313,1
Exploiting Common Characters in Chinese and Japanese to Learn Cross-Lingual Word Embeddings via Matrix Factorization,10.18653/v1/W18-3015,1
Object-oriented Neural Programming (OONP) for Document Understanding,10.18653/v1/P18-1253,1
CRUISE: Cold-Start New Skill Development via Iterative Utterance Generation,10.18653/v1/P18-4018,1
Sentence Classification for Investment Rules Detection,10.18653/v1/W18-3106,1
Jack the Reader – A Machine Reading Framework,10.18653/v1/P18-4005,1
Character-Level Models versus Morphology in Semantic Role Labeling,10.18653/v1/P18-1036,1
"Forms of Anaphoric Reference to Organisational Named Entities: Hoping to widen appeal, they diversified",10.18653/v1/W18-2406,1
LSTMs Exploit Linguistic Attributes of Data,10.18653/v1/W18-3024,1
Think Visually: Question Answering through Virtual Imagery,10.18653/v1/P18-1242,1
A Neural Autoencoder Approach for Document Ranking and Query Refinement in Pharmacogenomic Information Retrieval,10.18653/v1/W18-2310,1
HarriGT: A Tool for Linking News to Science,10.18653/v1/P18-4004,1
Tackling Adversarial Examples in QA via Answer Sentence Selection,10.18653/v1/W18-2604,1
Continuous Learning in a Hierarchical Multiscale Neural Network,10.18653/v1/P18-2001,1
Accurate SHRG-Based Semantic Parsing,10.18653/v1/P18-1038,1
Multi-task learning for historical text normalization: Size matters,10.18653/v1/W18-3403,1
Restricted Recurrent Neural Tensor Networks: Exploiting Word Frequency and Compositionality,10.18653/v1/P18-2002,1
CMMC-BDRC Solution to the NLP-TEA-2018 Chinese Grammatical Error Diagnosis Task,10.18653/v1/W18-3726,1
A neural parser as a direct classifier for head-final languages,10.18653/v1/W18-2906,0
EmotionX-JTML: Detecting emotions with Attention,10.18653/v1/W18-3510,0
Unsupervised Word Influencer Networks from News Streams,10.18653/v1/W18-3109,0
Learning Distributional Token Representations from Visual Features,10.18653/v1/W18-3025,0
Detecting Grammatical Errors in the NTOU CGED System by Identifying Frequent Subsentences,10.18653/v1/W18-3730,0
Compositional Morpheme Embeddings with Affixes as Functions and Stems as Arguments,10.18653/v1/W18-2901,0
Towards Automation of Sense-type Identification of Verbs in OntoSenseNet,10.18653/v1/W18-3511,0
Connecting Supervised and Unsupervised Sentence Embeddings,10.18653/v1/W18-3010,0
Improved Evaluation Framework for Complex Plagiarism Detection,10.18653/v1/P18-2026,0
Contextualized Character Representation for Chinese Grammatical Error Diagnosis,10.18653/v1/W18-3725,0
The DipInfo-UniTo system for SRST 2018,10.18653/v1/W18-3609,0
"A Flexible, Efficient and Accurate Framework for Community Question Answering Pipelines",10.18653/v1/P18-4023,0
"Praaline: An Open-Source System for Managing, Annotating, Visualising and Analysing Speech Corpora",10.18653/v1/P18-4019,0
Translating a Language You Don’t Know In the Chinese Room,10.18653/v1/P18-4011,0
NovelPerspective: Identifying Point of View Characters,10.18653/v1/P18-4002,0
Alignment Analysis of Sequential Segmentation of Lexicons to Improve Automatic Cognate Detection,10.18653/v1/P18-3019,0
Exploring Chunk Based Templates for Generating a subset of English Text,10.18653/v1/P18-3017,0
Graph-based Filtering of Out-of-Vocabulary Words for Encoder-Decoder Models,10.18653/v1/P18-3016,0
SuperNMT: Neural Machine Translation with Semantic Supersenses and Syntactic Supertags,10.18653/v1/P18-3010,0
German and French Neural Supertagging Experiments for LTAG Parsing,10.18653/v1/P18-3009,0
Prefix Lexicalization of Synchronous CFGs using Synchronous TAG,10.18653/v1/P18-1107,0
Generalized chart constraints for efficient PCFG and TAG parsing,10.18653/v1/P18-2099,0
Higher-order Relation Schema Induction using Tensor Factorization with Back-off and Aggregation,10.18653/v1/P18-1146,0
A Distributional and Orthographic Aggregation Model for English Derivational Morphology,10.18653/v1/P18-1180,0
Interactive Language Acquisition with One-shot Visual Concept Learning through a Conversational Game,10.18653/v1/P18-1243,0
A Structured Variational Autoencoder for Contextual Morphological Inflection,10.18653/v1/P18-1245,0
Pre- and In-Parsing Models for Neural Empty Category Detection,10.18653/v1/P18-1250,0
Learning from Chunk-based Feedback in Neural Machine Translation,10.18653/v1/P18-2052,0
Let’s do it “again”: A First Computational Approach to Detecting Adverbial Presupposition Triggers,10.18653/v1/P18-1256,0
Narrative Modeling with Memory Chains and Semantic Supervision,10.18653/v1/P18-2045,0
100 Things You Always Wanted to Know about Semantics & Pragmatics But Were Afraid to Ask,10.18653/v1/P18-5001,0
Connecting Language and Vision to Actions,10.18653/v1/P18-5004,0
Measuring Beginner Friendliness of Japanese Web Pages explaining Academic Concepts by Integrating Neural Image Feature and Text Features,10.18653/v1/W18-3721,0
NILC-SWORNEMO at the Surface Realization Shared Task: Exploring Syntax-Based Word Ordering using Neural Models,10.18653/v1/W18-3608,0
Textual Features Indicative of Writing Proficiency in Elementary School Spanish Documents,10.18653/v1/W18-3716,0
Selecting NLP Techniques to Evaluate Learning Design Objectives in Collaborative Multi-perspective Elaboration Activities,10.18653/v1/W18-3712,0
The Importance of Recommender and Feedback Features in a Pronunciation Learning Aid,10.18653/v1/W18-3711,0
Ling@CASS Solution to the NLP-TEA CGED Shared Task 2018,10.18653/v1/W18-3709,0
Named Entity Recognition on Code-Switched Data Using Conditional Random Fields,10.18653/v1/W18-3215,0
The University of Texas System Submission for the Code-Switching Workshop Shared Task 2018,10.18653/v1/W18-3216,0
Tackling Code-Switched NER: Participation of CMU,10.18653/v1/W18-3217,0
Multilingual Named Entity Recognition on Spanish-English Code-switched Tweets using Support Vector Machines,10.18653/v1/W18-3218,0
Connecting Distant Entities with Induction through Conditional Random Fields for Named Entity Recognition: Precursor-Induced CRF,10.18653/v1/W18-2402,0
Rating Distributions and Bayesian Inference: Enhancing Cognitive Models of Spatial Language Use,10.18653/v1/W18-2807,0
Affordances in Grounded Language Learning,10.18653/v1/W18-2806,0
Multi-glance Reading Model for Text Understanding,10.18653/v1/W18-2804,0
Toward Cross-Domain Engagement Analysis in Medical Notes,10.18653/v1/W18-2325,0
On Learning Better Embeddings from Chinese Clinical Records: Study on Combining In-Domain and Out-Domain Data,10.18653/v1/W18-2323,0
Bacteria and Biotope Entity Recognition Using A Dictionary-Enhanced Neural Network Model,10.18653/v1/W18-2317,0
BinLin: A Simple Method of Dependency Tree Linearization,10.18653/v1/W18-3602,0
IIT (BHU) Varanasi at MSR-SRST 2018: A Language Model Based Approach for Natural Language Generation,10.18653/v1/W18-3603,0
Surface Realization Shared Task 2018 (SR18): The Tilburg University Approach,10.18653/v1/W18-3604,0
AX Semantics’ Submission to the Surface Realization Shared Task 2018,10.18653/v1/W18-3607,0
Beyond Multiword Expressions: Processing Idioms and Metaphors,10.18653/v1/P18-5005,0
