Title,DOI,Citations
Deciphering Related Languages,10.18653/v1/D17-1266,3
Incremental Graph-based Neural Dependency Parsing,10.18653/v1/D17-1173,3
Inducing Semantic Micro-Clusters from Deep Multi-View Representations of Novels,10.18653/v1/D17-1200,3
The NLTK FrameNet API: Designing for Discoverability with a Rich Linguistic Resource,10.18653/v1/D17-2001,3
Fine Grained Citation Span for References in Wikipedia,10.18653/v1/D17-1212,3
Idiom-Aware Compositional Distributed Semantics,10.18653/v1/D17-1124,3
Learning the Structure of Variable-Order CRFs: a finite-state perspective,10.18653/v1/D17-1044,3
Piecewise Latent Variables for Neural Variational Text Processing,10.18653/v1/D17-1043,3
Classification of telicity using cross-linguistic annotation projection,10.18653/v1/D17-1271,3
Where is Misty? Interpreting Spatial Descriptors by Modeling Regions in Space,10.18653/v1/D17-1015,2
Efficient Discontinuous Phrase-Structure Parsing via the Generalized Maximum Spanning Arborescence,10.18653/v1/D17-1172,2
Neural Discontinuous Constituency Parsing,10.18653/v1/D17-1174,2
CRF Autoencoder for Unsupervised Dependency Parsing,10.18653/v1/D17-1171,2
Why ADAGRAD Fails for Online Topic Modeling,10.18653/v1/D17-1046,2
Learning What’s Easy: Fully Differentiable Neural Easy-First Taggers,10.18653/v1/D17-1036,2
A Novel Cascade Model for Learning Latent Similarity from Heterogeneous Sequential Data of MOOC,10.18653/v1/D17-1293,2
Importance sampling for unbiased on-demand evaluation of knowledge base population,10.18653/v1/D17-1109,2
Recovering Question Answering Errors via Query Revision,10.18653/v1/D17-1094,2
Sequence Effects in Crowdsourced Annotations,10.18653/v1/D17-1306,2
Word Embeddings based on Fixed-Size Ordinally Forgetting Encoding,10.18653/v1/D17-1031,2
Charmanteau: Character Embedding Models For Portmanteau Creation,10.18653/v1/D17-1315,2
Segmentation-Free Word Embedding for Unsegmented Languages,10.18653/v1/D17-1080,2
The Labeled Segmentation of Printed Books,10.18653/v1/D17-1077,2
Learning Fine-grained Relations from Chinese User Generated Categories,10.18653/v1/D17-1273,2
Filling the Blanks (hint: plural noun) for Mad Libs Humor,10.18653/v1/D17-1067,2
Affinity-Preserving Random Walk for Multi-Document Summarization,10.18653/v1/D17-1020,2
Never Abandon Minorities: Exhaustive Extraction of Bursty Phrases on Microblogs Using Set Cover Problem,10.18653/v1/D17-1251,2
The Impact of Modeling Overall Argumentation with Tree Kernels,10.18653/v1/D17-1253,2
Temporal dynamics of semantic relations in word embeddings: an application to predicting armed conflict participants,10.18653/v1/D17-1194,2
Learning to Rank Semantic Coherence for Topic Segmentation,10.18653/v1/D17-1139,2
Towards Compact and Fast Neural Machine Translation Using a Combined Method,10.18653/v1/D17-1154,2
Repeat before Forgetting: Spaced Repetition for Efficient and Effective Training of Neural Networks,10.18653/v1/D17-1255,2
Cross-Lingual Induction and Transfer of Verb Classes Based on Word Vector Space Specialisation,10.18653/v1/D17-1270,2
VecShare: A Framework for Sharing Word Representation Vectors,10.18653/v1/D17-1032,1
Learning what to read: Focused machine reading,10.18653/v1/D17-1313,1
A Simpler and More Generalizable Story Detector using Verb and Character Features,10.18653/v1/D17-1287,1
Paradigm Completion for Derivational Morphology,10.18653/v1/D17-1074,1
Latent Space Embedding for Retrieval in Question-Answer Archives,10.18653/v1/D17-1089,1
A Simple Language Model based on PMI Matrix Approximations,10.18653/v1/D17-1198,1
StruAP: A Tool for Bundling Linguistic Trees through Structure-based Abstract Pattern,10.18653/v1/D17-2006,1
The Projector: An Interactive Annotation Projection Visualization Tool,10.18653/v1/D17-2008,1
SGNMT – A Flexible NMT Decoding Platform for Quick Prototyping of New Models and Search Strategies,10.18653/v1/D17-2005,1
"Quasi-Second-Order Parsing for 1-Endpoint-Crossing, Pagenumber-2 Graphs",10.18653/v1/D17-1003,1
Function Assistant: A Tool for NL Querying of APIs,10.18653/v1/D17-2012,1
An Empirical Analysis of Edit Importance between Document Versions,10.18653/v1/D17-1295,1
Learning Translations via Matrix Completion,10.18653/v1/D17-1152,1
Controlling Human Perception of Basic User Traits,10.18653/v1/D17-1248,1
Revisiting Selectional Preferences for Coreference Resolution,10.18653/v1/D17-1138,1
CROWD-IN-THE-LOOP: A Hybrid Approach for Annotating Semantic Roles,10.18653/v1/D17-1205,0
TAG Parsing with Neural Networks and Vector Representations of Supertags,10.18653/v1/D17-1180,0
MoodSwipe: A Soft Keyboard that Suggests MessageBased on User-Specified Emotions,10.18653/v1/D17-2013,0
KnowYourNyms? A Game of Semantic Relationships,10.18653/v1/D17-2007,0
Interactive Visualization for Linguistic Structure,10.18653/v1/D17-2009,0
An Analysis and Visualization Tool for Case Study Learning of Linguistic Concepts,10.18653/v1/D17-2003,0
Adapting Topic Models using Lexical Associations with Tree Priors,10.18653/v1/D17-1203,0
Dependency Grammar Induction with Neural Lexicalization and Big Training Data,10.18653/v1/D17-1176,0
Combining Generative and Discriminative Approaches to Unsupervised Dependency Parsing via Dual Decomposition,10.18653/v1/D17-1177,0
Break it Down for Me: A Study in Automated Lyric Annotation,10.18653/v1/D17-1220,0
Towards Automatic Construction of News Overview Articles by News Synthesis,10.18653/v1/D17-1224,0
Unfolding and Shrinking Neural Machine Translation Ensembles,10.18653/v1/D17-1208,0
Source-Side Left-to-Right or Target-Side Left-to-Right? An Empirical Comparison of Two Phrase-Based Decoding Algorithms,10.18653/v1/D17-1157,0
"Machine Translation, it’s a question of style, innit? The case of English tag questions",10.18653/v1/D17-1265,0
Further Investigation into Reference Bias in Monolingual Evaluation of Machine Translation,10.18653/v1/D17-1262,0
Deriving continous grounded meaning representations from referentially structured multimodal contexts,10.18653/v1/D17-1100,0
Evaluating Hierarchies of Verb Argument Structure with Hierarchical Clustering,10.18653/v1/D17-1104,0
Dimensions of Interpersonal Relationships: Corpus and Experiments,10.18653/v1/D17-1244,0
Speeding up Reinforcement Learning-based Information Extraction Training using Asynchronous Methods,10.18653/v1/D17-1281,0
Word Etymology as Native Language Interference,10.18653/v1/D17-1286,0
Exploiting Morphological Regularities in Distributional Word Representations,10.18653/v1/D17-1028,0
Analogs of Linguistic Structure in Deep Representations,10.18653/v1/D17-1311,0
"Acquisition, Representation and Usage of Conceptual Hierarchies",,0
Computational Sarcasm,,0
"Graph-based Text Representations: Boosting Text Mining, NLP and Information Retrieval with Graphs",,0
Semantic Role Labeling,,0
Memory Augmented Neural Networks for Natural Language Processing,,0
A Unified Framework for Structured Prediction: From Theory to Practice,,0
Cross-Lingual Word Representations: Induction and Evaluation,,0
