Title,DOI,Citations
Uphill from here: Sentiment patterns in videos from left- and right-wing YouTube news channels,10.18653/v1/W19-2110,6
Improving Cuneiform Language Identification with BERT,10.18653/v1/W19-1402,6
Domain adaptation for part-of-speech tagging of noisy user-generated text,10.18653/v1/N19-1345,6
Relation Classification Using Segment-Level Attention-based CNN and Dependency-based RNN,10.18653/v1/N19-1286,6
Improving Domain Adaptation Translation with Domain Invariant and Specific Information,10.18653/v1/N19-1312,6
Cross-lingual Subjectivity Detection for Resource Lean Languages,10.18653/v1/W19-1310,6
Plain English Summarization of Contracts,10.18653/v1/W19-2201,6
An Analysis of Attention over Clinical Notes for Predictive Tasks,10.18653/v1/W19-1902,6
Depressed Individuals Use Negative Self-Focused Language When Recalling Recent Interactions with Close Romantic Partners but Not Family or Friends,10.18653/v1/W19-3008,6
Dependency Parsing with your Eyes: Dependency Structure Predicts Eye Regressions During Reading,10.18653/v1/W19-2909,6
PAWS: Paraphrase Adversaries from Word Scrambling,10.18653/v1/N19-1131,6
Frequency vs. Association for Constraint Selection in Usage-Based Construction Grammar,10.18653/v1/W19-2913,6
Tweet Classification without the Tweet: An Empirical Examination of User versus Document Attributes,10.18653/v1/W19-2103,6
Density Matching for Bilingual Word Embedding,10.18653/v1/N19-1161,6
Bi-Directional Differentiable Input Reconstruction for Low-Resource Neural Machine Translation,10.18653/v1/N19-1043,6
Cross-lingual Multi-Level Adversarial Transfer to Enhance Low-Resource Name Tagging,10.18653/v1/N19-1383,6
Audio De-identification - a New Entity Recognition Task,10.18653/v1/N19-2025,6
A Submodular Feature-Aware Framework for Label Subset Selection in Extreme Classification Problems,10.18653/v1/N19-1106,6
Step-by-Step: Separating Planning from Realization in Neural Data-to-Text Generation,10.18653/v1/N19-1236,6
Geolocating Political Events in Text,10.18653/v1/W19-2104,6
Analyzing Incorporation of Emotion in Emoji Prediction,10.18653/v1/W19-1311,6
Scalable Methods for Annotating Legal-Decision Corpora,10.18653/v1/W19-2202,5
Stylometric Classification of Ancient Greek Literary Texts by Genre,10.18653/v1/W19-2507,5
CODAH: An Adversarially-Authored Question Answering Dataset for Common Sense,10.18653/v1/W19-2008,5
Semantic Spatial Representation: a unique representation of an environment based on an ontology for robotic applications,10.18653/v1/W19-1606,5
A Report on the Third VarDial Evaluation Campaign,10.18653/v1/W19-1401,5
Speech-based Estimation of Bulbar Regression in Amyotrophic Lateral Sclerosis,10.18653/v1/W19-1704,5
How Well Do Embedding Models Capture Non-compositionality? A View from Multiword Expressions,10.18653/v1/W19-2004,5
Unsupervised Hierarchical Story Infilling,10.18653/v1/W19-2405,5
Language Discrimination and Transfer Learning for Similar Languages: Experiments with Feature Combinations and Adaptation,10.18653/v1/W19-1406,5
GraphIE: A Graph-Based Framework for Information Extraction,10.18653/v1/N19-1082,5
Towards Coherent and Cohesive Long-form Text Generation,10.18653/v1/W19-2401,5
Exploiting Noisy Data in Distant Supervision Relation Classification,10.18653/v1/N19-1325,5
Adapting RNN Sequence Prediction Model to Multi-label Set Prediction,10.18653/v1/N19-1321,5
Studying the Inductive Biases of RNNs with Synthetic Variations of Natural Languages,10.18653/v1/N19-1356,5
Review-Driven Multi-Label Music Style Classification by Exploiting Style Correlations,10.18653/v1/N19-1296,5
Modeling Behavioral Aspects of Social Media Discourse for Moral Classification,10.18653/v1/W19-2112,5
"How to Compare Summarizers without Target Length? Pitfalls, Solutions and Re-Examination of the Neural Summarization Literature",10.18653/v1/W19-2303,5
An Adversarial Learning Framework For A Persona-Based Multi-Turn Dialogue Model,10.18653/v1/W19-2301,5
Automatically Generating Psychiatric Case Notes From Digital Transcripts of Doctor-Patient Conversations,10.18653/v1/W19-1918,5
Cross-Corpora Evaluation and Analysis of Grammatical Error Correction Models — Is Single-Corpus Evaluation Enough?,10.18653/v1/N19-1132,5
Overcoming the bottleneck in traditional assessments of verbal memory: Modeling human ratings and classifying clinical group membership,10.18653/v1/W19-3016,5
Predicting Suicide Risk from Online Postings in Reddit The UGent-IDLab submission to the CLPysch 2019 Shared Task A,10.18653/v1/W19-3019,5
A Crowdsourced Frame Disambiguation Corpus with Ambiguity,10.18653/v1/N19-1224,5
Crowdsourcing Lightweight Pyramids for Manual Summary Evaluation,10.18653/v1/N19-1072,5
Left-to-Right Dependency Parsing with Pointer Networks,10.18653/v1/N19-1076,5
Fluent Translations from Disfluent Speech in End-to-End Speech Translation,10.18653/v1/N19-1285,5
Text Classification with Few Examples using Controlled Generalization,10.18653/v1/N19-1319,5
Using Contextual Representations for Suicide Risk Assessment from Internet Forums,10.18653/v1/W19-3022,5
Learning Unsupervised Multilingual Word Embeddings with Incremental Multilingual Hubs,10.18653/v1/N19-1188,5
Text Generation from Knowledge Graphs with Graph Transformers,10.18653/v1/N19-1238,5
One Size Does Not Fit All: Comparing NMT Representations of Different Granularities,10.18653/v1/N19-1154,5
On Knowledge distillation from complex networks for response prediction,10.18653/v1/N19-1382,5
Measuring the perceptual availability of phonological features during language acquisition using unsupervised binary stochastic autoencoders,10.18653/v1/N19-1007,5
Integration of Knowledge Graph Embedding Into Topic Modeling with Hierarchical Dirichlet Process,10.18653/v1/N19-1099,5
Strong Baselines for Complex Word Identification across Multiple Languages,10.18653/v1/N19-1102,5
UHop: An Unrestricted-Hop Relation Extraction Framework for Knowledge-Based Question Answering,10.18653/v1/N19-1031,5
A Variational Approach to Weakly Supervised Document-Level Multi-Aspect Sentiment Classification,10.18653/v1/N19-1036,5
Code-Switching for Enhancing NMT with Pre-Specified Translation,10.18653/v1/N19-1044,5
Learning Bilingual Sentiment-Specific Word Embeddings without Cross-lingual Supervision,10.18653/v1/N19-1040,5
Data Augmentation by Data Noising for Open-vocabulary Slots in Spoken Language Understanding,10.18653/v1/N19-3014,5
Handling Noisy Labels for Robustly Learning from Self-Training Data for Low-Resource Sequence Labeling,10.18653/v1/N19-3005,5
Latent Code and Text-based Generative Adversarial Networks for Soft-text Generation,10.18653/v1/N19-1234,5
CLaC at CLPsych 2019: Fusion of Neural Features and Predicted Class Probabilities for Suicide Risk Assessment Based on Online Posts,10.18653/v1/W19-3004,5
Practical Semantic Parsing for Spoken Language Understanding,10.18653/v1/N19-2003,5
Fixed That for You: Generating Contrastive Claims with Semantic Edits,10.18653/v1/N19-1174,4
Designing a Symbolic Intermediate Representation for Neural Surface Realization,10.18653/v1/W19-2308,4
Joint Approach to Deromanization of Code-mixed Texts,10.18653/v1/W19-1403,4
Cross-lingual Visual Verb Sense Disambiguation,10.18653/v1/N19-1200,4
A Sociolinguistic Study of Online Echo Chambers on Twitter,10.18653/v1/W19-2109,4
Neural Text Simplification in Low-Resource Conditions Using Weak Supervision,10.18653/v1/W19-2305,4
Permanent Magnetic Articulograph (PMA) vs Electromagnetic Articulograph (EMA) in Articulation-to-Speech Synthesis for Silent Speech Interface,10.18653/v1/W19-1703,4
Pun Generation with Surprise,10.18653/v1/N19-1172,4
A Simple Joint Model for Improved Contextual Neural Lemmatization,10.18653/v1/N19-1155,4
Are Fictional Voices Distinguishable? Classifying Character Voices in Modern Drama,10.18653/v1/W19-2504,4
Towards augmenting crisis counselor training by improving message retrieval,10.18653/v1/W19-3001,4
Locale-agnostic Universal Domain Classification Model in Spoken Language Understanding,10.18653/v1/N19-2002,4
Stochastic Wasserstein Autoencoder for Probabilistic Sentence Generation,10.18653/v1/N19-1411,4
Neural Lexicons for Slot Tagging in Spoken Language Understanding,10.18653/v1/N19-2011,4
Fast Prototyping a Dialogue Comprehension System for Nurse-Patient Conversations on Symptom Monitoring,10.18653/v1/N19-2004,4
Sequential Attention with Keyword Mask Model for Community-based Question Answering,10.18653/v1/N19-1228,4
Neural Text Generation from Rich Semantic Representations,10.18653/v1/N19-1235,4
Evaluating Text GANs as Language Models,10.18653/v1/N19-1233,4
"A Qualitative Comparison of CoQA, SQuAD 2.0 and QuAC",10.18653/v1/N19-1241,4
ChatEval: A Tool for Chatbot Evaluation,10.18653/v1/N19-4011,4
Extracting Adverse Drug Event Information with Minimal Engineering,10.18653/v1/W19-1903,4
Abusive Language Detection with Graph Convolutional Networks,10.18653/v1/N19-1221,4
On the Importance of Distinguishing Word Meaning Representations: A Case Study on Reverse Dictionary Mapping,10.18653/v1/N19-1222,4
Cooperative Learning of Disjoint Syntax and Semantics,10.18653/v1/N19-1115,4
Multimodal Machine Translation with Embedding Prediction,10.18653/v1/N19-3012,4
"Scalable, Semi-Supervised Extraction of Structured Information from Scientific Literature",10.18653/v1/W19-2602,4
MuST-C: a Multilingual Speech Translation Corpus,10.18653/v1/N19-1202,4
The Active-Filler Strategy in a Move-Eager Left-Corner Minimalist Grammar Parser,10.18653/v1/W19-2901,4
Dictionaries and Decision Trees for the 2019 CLPsych Shared Task,10.18653/v1/W19-3025,4
Detecting dementia in Mandarin Chinese using transfer learning from a parallel corpus,10.18653/v1/N19-1199,4
Using natural conversations to classify autism with limited data: Age matters,10.18653/v1/W19-3006,4
FreebaseQA: A New Factoid QA Data Set Matching Trivia-Style Question-Answer Pairs with Freebase,10.18653/v1/N19-1028,4
MathQA: Towards Interpretable Math Word Problem Solving with Operation-Based Formalisms,10.18653/v1/N19-1245,4
Abstractive Summarization of Reddit Posts with Multi-level Memory Networks,10.18653/v1/N19-1260,4
Evaluating Composition Models for Verb Phrase Elliptical Sentence Embeddings,10.18653/v1/N19-1023,4
Incorporating Context and External Knowledge for Pronoun Coreference Resolution,10.18653/v1/N19-1093,4
Unsupervised Deep Structured Semantic Models for Commonsense Reasoning,10.18653/v1/N19-1094,4
Understanding Learning Dynamics Of Language Models with SVCCA,10.18653/v1/N19-1329,4
Improving Dialogue State Tracking by Discerning the Relevant Context,10.18653/v1/N19-1057,4
Syntax-aware Neural Semantic Role Labeling with Supertags,10.18653/v1/N19-1075,4
The Extent of Repetition in Contract Language,10.18653/v1/W19-2203,4
Semi-Supervised Teacher-Student Architecture for Relation Extraction,10.18653/v1/W19-1505,4
Lightly-supervised Representation Learning with Global Interpretability,10.18653/v1/W19-1504,4
Modeling Global Syntactic Variation in English Using Dialect Classification,10.18653/v1/W19-1405,3
Experiments in Cuneiform Language Identification,10.18653/v1/W19-1423,3
Benchmarking Approximate Inference Methods for Neural Structured Prediction,10.18653/v1/N19-1335,3
Enhancing Opinion Role Labeling with Semantic-Aware Word Representations from Semantic Role Labeling,10.18653/v1/N19-1066,3
SWOW-8500: Word Association task for Intrinsic Evaluation of Word Embeddings,10.18653/v1/W19-2006,3
Classification of Semantic Paraphasias: Optimization of a Word Embedding Model,10.18653/v1/W19-2007,3
Neural Constituency Parsing of Speech Transcripts,10.18653/v1/N19-1282,3
Paraphrase Generation for Semi-Supervised Learning in NLU,10.18653/v1/W19-2306,3
DAL: Dual Adversarial Learning for Dialogue Generation,10.18653/v1/W19-2302,3
Developing and Orchestrating a Portfolio of Natural Legal Language Processing and Document Curation Services,10.18653/v1/W19-2207,3
"Identification, Interpretability, and Bayesian Word Embeddings",10.18653/v1/W19-2102,3
Typological Features for Multilingual Delexicalised Dependency Parsing,10.18653/v1/N19-1393,3
Riemannian Normalizing Flow on Variational Wasserstein Autoencoder for Text Modeling,10.18653/v1/N19-1025,3
Dialogue Act Classification with Context-Aware Self-Attention,10.18653/v1/N19-1373,3
Towards Content Transfer through Grounded Text Generation,10.18653/v1/N19-1269,3
HiGRU: Hierarchical Gated Recurrent Units for Utterance-Level Emotion Recognition,10.18653/v1/N19-1037,3
Deep Cross-Lingual Coreference Resolution for Less-Resourced Languages: The Case of Basque,10.18653/v1/W19-2806,3
Modeling Word Emotion in Historical Language: Quantity Beats Supposed Stability in Seed Word Selection,10.18653/v1/W19-2501,3
Learning Interpretable Negation Rules via Weak Supervision at Document Level: A Reinforcement Learning Approach,10.18653/v1/N19-1038,3
CAN-NER: Convolutional Attention Network for Chinese Named Entity Recognition,10.18653/v1/N19-1342,3
Multilingual prediction of Alzheimer’s disease through domain adaptation and concept-based language modelling,10.18653/v1/N19-1367,3
Recursive Routing Networks: Learning to Compose Modules for Language Understanding,10.18653/v1/N19-1365,3
Legal Linking: Citation Resolution and Suggestion in Constitutional Law,10.18653/v1/W19-2205,3
IMHO Fine-Tuning Improves Claim Detection,10.18653/v1/N19-1054,3
Neural Machine Translation of Text from Non-Native Speakers,10.18653/v1/N19-1311,3
Predicting Malware Attributes from Cybersecurity Texts,10.18653/v1/N19-1293,3
Semantics and Homothetic Clustering of Hafez Poetry,10.18653/v1/W19-2511,3
Relation Extraction with Temporal Reasoning Based on Memory Augmented Distant Supervision,10.18653/v1/N19-1107,3
A Simple and Robust Approach to Detecting Subject-Verb Agreement Errors,10.18653/v1/N19-1251,3
Be Consistent! Improving Procedural Text Comprehension using Label Consistency,10.18653/v1/N19-1244,3
Introduction to Discourse Relation Parsing and Treebanking (DISRPT): 7th Workshop on Rhetorical Structure Theory and Related Formalisms,10.18653/v1/W19-2701,3
FAKTA: An Automatic End-to-End Fact Checking System,10.18653/v1/N19-4014,3
Applying Rhetorical Structure Theory to Student Essays for Providing Automated Writing Feedback,10.18653/v1/W19-2720,3
Deep Adversarial Learning for NLP,10.18653/v1/N19-5001,3
Conversation Model Fine-Tuning for Classifying Client Utterances in Counseling Dialogues,10.18653/v1/N19-1148,3
SEDTWik: Segmentation-based Event Detection from Tweets Using Wikipedia,10.18653/v1/N19-3011,3
Effective Feature Representation for Clinical Text Concept Extraction,10.18653/v1/W19-1901,3
Variation between Different Discourse Types: Literate vs. Oral,10.18653/v1/W19-1407,3
A Streamlined Method for Sourcing Discourse-level Argumentation Annotations from the Crowd,10.18653/v1/N19-1177,3
A Crowdsourced Corpus of Multiple Judgments and Disagreement on Anaphoric Interpretation,10.18653/v1/N19-1176,3
"Multilingual Entity, Relation, Event and Human Value Extraction",10.18653/v1/N19-4019,3
Suicide Risk Assessment on Social Media: USI-UPF at the CLPsych 2019 Shared Task,10.18653/v1/W19-3021,3
ConvSent at CLPsych 2019 Task A: Using Post-level Sentiment Features for Suicide Risk Prediction on Reddit,10.18653/v1/W19-3024,3
Robust Semantic Parsing with Adversarial Learning for Domain Generalization,10.18653/v1/N19-2021,3
Opinion Mining with Deep Contextualized Embeddings,10.18653/v1/N19-3006,3
Simple Attention-Based Representation Learning for Ranking Short Social Media Posts,10.18653/v1/N19-1229,3
Cross-lingual NIL Entity Clustering for Low-resource Languages,10.18653/v1/W19-2804,3
A Probabilistic Generative Model of Linguistic Typology,10.18653/v1/N19-1156,3
Augmenting word2vec with latent Dirichlet allocation within a clinical application,10.18653/v1/N19-1414,3
Cross-lingual Transfer Learning for Japanese Named Entity Recognition,10.18653/v1/N19-2023,3
Generating Text through Adversarial Training Using Skip-Thought Vectors,10.18653/v1/N19-3008,3
Evaluation of named entity coreference,10.18653/v1/W19-2801,3
Neural Coreference Resolution with Limited Lexical Context and Explicit Mention Detection for Oral French,10.18653/v1/W19-2802,3
The Development of Abstract Concepts in Children’s Early Lexical Networks,10.18653/v1/W19-2914,3
Joint Learning of Pre-Trained and Random Units for Domain Adaptation in Part-of-Speech Tagging,10.18653/v1/N19-1416,3
Show Some Love to Your n-grams: A Bit of Progress and Stronger n-gram Language Modeling Baselines,10.18653/v1/N19-1417,3
SpatialNet: A Declarative Resource for Spatial Relations,10.18653/v1/W19-1607,3
Investigating Machine Learning Methods for Language and Dialect Identification of Cuneiform Texts,10.18653/v1/W19-1420,3
Detecting cognitive impairments by agreeing on interpretations of linguistic features,10.18653/v1/N19-1146,3
Joint Detection and Location of English Puns,10.18653/v1/N19-1217,3
Modeling Personal Biases in Language Use by Inducing Personalized Word Embeddings,10.18653/v1/N19-1215,3
Personalized Neural Embeddings for Collaborative Filtering with Text,10.18653/v1/N19-1212,3
Active Learning for New Domains in Natural Language Understanding,10.18653/v1/N19-2012,3
On the Feasibility of Automated Detection of Allusive Text Reuse,10.18653/v1/W19-2514,3
Clustering-Based Article Identification in Historical Newspapers,10.18653/v1/W19-2502,2
The Scientization of Literary Study,10.18653/v1/W19-2503,2
Word Embedding-Based Automatic MT Evaluation Metric using Word Position Information,10.18653/v1/N19-1186,2
Generating Knowledge Graph Paths from Textual Definitions using Sequence-to-Sequence Models,10.18653/v1/N19-1196,2
Tweet Stance Detection Using an Attention based Neural Ensemble Model,10.18653/v1/N19-1185,2
Mutual Information Maximization for Simple and Accurate Part-Of-Speech Induction,10.18653/v1/N19-1113,2
OpenKI: Integrating Open Information Extraction and Knowledge Bases with Relation Inference,10.18653/v1/N19-1083,2
"Better, Faster, Stronger Sequence Tagging Constituent Parsers",10.18653/v1/N19-1341,2
Topic Spotting using Hierarchical Networks with Self Attention,10.18653/v1/N19-1376,2
Automatic Alignment and Annotation Projection for Literary Texts,10.18653/v1/W19-2505,2
Bilingual-GAN: A Step Towards Parallel Text Generation,10.18653/v1/W19-2307,2
Learning Relational Representations by Analogy using Hierarchical Siamese Networks,10.18653/v1/N19-1327,2
Neural Text Style Transfer via Denoising and Reranking,10.18653/v1/W19-2309,2
Acoustic-to-Word Models with Conversational Context Information,10.18653/v1/N19-1283,2
The Steep Road to Happily Ever after: an Analysis of Current Visual Storytelling Models,10.18653/v1/W19-1805,2
Learning Multilingual Word Embeddings Using Image-Text Data,10.18653/v1/W19-1807,2
Discriminating between Mandarin Chinese and Swiss-German varieties using adaptive language models,10.18653/v1/W19-1419,2
Decomposed Local Models for Coordinate Structure Parsing,10.18653/v1/N19-1343,2
"Big BiRD: A Large, Fine-Grained, Bigram Relatedness Dataset for Examining Semantic Composition",10.18653/v1/N19-1050,2
Unsupervised Dialog Structure Learning,10.18653/v1/N19-1178,2
Lost in Machine Translation: A Method to Reduce Meaning Loss,10.18653/v1/N19-1042,2
ExCL: Extractive Clip Localization Using Natural Language Descriptions,10.18653/v1/N19-1198,2
Scalable Collapsed Inference for High-Dimensional Topic Models,10.18653/v1/N19-1291,2
Evaluation of Morphological Embeddings for English and Russian Languages,10.18653/v1/W19-2010,2
The Influence of Down-Sampling Strategies on SVD Word Embedding Stability,10.18653/v1/W19-2003,2
Characterizing the Impact of Geometric Properties of Word Embeddings on Task Performance,10.18653/v1/W19-2002,2
Character Identification Refined: A Proposal,10.18653/v1/W19-2402,2
Extraction of Message Sequence Charts from Narrative History Text,10.18653/v1/W19-2404,2
Tracking Discrete and Continuous Entity State for Process Understanding,10.18653/v1/W19-1502,2
Identifying Sensible Lexical Relations in Generated Stories,10.18653/v1/W19-2406,2
Leveraging Pretrained Word Embeddings for Part-of-Speech Tagging of Code Switching Data,10.18653/v1/W19-1410,2
Using Structured Representation and Data: A Hybrid Model for Negation and Sentiment in Customer Service Conversations,10.18653/v1/W19-1306,2
The Rhetorical Structure of Attribution,10.18653/v1/W19-2706,2
Differentiable Sampling with Flexible Reference Word Order for Neural Machine Translation,10.18653/v1/N19-1207,2
Is It Dish Washer Safe? Automatically Answering “Yes/No” Questions Using Customer Reviews,10.18653/v1/N19-3001,2
Content-based Dwell Time Engagement Prediction Model for News Articles,10.18653/v1/N19-2028,2
Exploring Fine-Tuned Embeddings that Model Intensifiers for Emotion Analysis,10.18653/v1/W19-1304,2
Modeling Hierarchical Syntactic Structures in Morphological Processing,10.18653/v1/W19-2905,2
Applications of Natural Language Processing in Clinical Research and Practice,10.18653/v1/N19-5006,2
Expectation and Locality Effects in the Prediction of Disfluent Fillers and Repairs in English Speech,10.18653/v1/N19-3015,2
ADIDA: Automatic Dialect Identification for Arabic,10.18653/v1/N19-4002,2
DTeam @ VarDial 2019: Ensemble based on skip-gram and triplet loss neural networks for Moldavian vs. Romanian cross-dialect topic identification,10.18653/v1/W19-1422,2
OpenCeres: When Open Information Extraction Meets the Semi-Structured Web,10.18653/v1/N19-1309,2
Understanding the Polarity of Events in the Biomedical Literature: Deep Learning vs. Linguistically-informed Methods,10.18653/v1/W19-2603,2
Issue Framing in Online Discussion Fora,10.18653/v1/N19-1142,2
Towards the Data-driven System for Rhetorical Parsing of Russian Texts,10.18653/v1/W19-2711,2
Priming vs. Inhibition of Optional Infinitival “to”,10.18653/v1/W19-2902,2
Simulating Spanish-English Code-Switching: El Modelo Está Generating Code-Switches,10.18653/v1/W19-2903,2
Analyzing the use of existing systems for the CLPsych 2019 Shared Task,10.18653/v1/W19-3017,2
Reviving a psychometric measure: Classification and prediction of the Operant Motive Test,10.18653/v1/W19-3014,2
"Partial Or Complete, That’s The Question",10.18653/v1/N19-1227,2
CNM: An Interpretable Complex-valued Network for Matching,10.18653/v1/N19-1420,2
Verb-Second Effect on Quantifier Scope Interpretation,10.18653/v1/W19-2915,2
Neural Self-Training through Spaced Repetition,10.18653/v1/N19-1003,2
The Role of Utterance Boundaries and Word Frequencies for Part-of-speech Learning in Brazilian Portuguese Through Distributional Analysis,10.18653/v1/W19-2917,2
Understanding language-elicited EEG data by predicting it from a fine-tuned language model,10.18653/v1/N19-1005,2
Extraction of Message Sequence Charts from Software Use-Case Descriptions,10.18653/v1/N19-2017,2
Diversifying Reply Suggestions Using a Matching-Conditional Variational Autoencoder,10.18653/v1/N19-2006,2
Recovering dropped pronouns in Chinese conversations via modeling their referents,10.18653/v1/N19-1095,2
Self-Discriminative Learning for Unsupervised Document Embedding,10.18653/v1/N19-1255,2
Zero-Shot Cross-Lingual Opinion Target Extraction,10.18653/v1/N19-1257,2
Answer-based Adversarial Training for Generating Clarification Questions,10.18653/v1/N19-1013,2
Tensorized Self-Attention: Efficiently Modeling Pairwise and Global Dependencies Together,10.18653/v1/N19-1127,2
Recursive Subtree Composition in LSTM-Based Dependency Parsing,10.18653/v1/N19-1159,2
Modelling Instance-Level Annotator Reliability for Natural Language Labelling Tasks,10.18653/v1/N19-1295,2
Accelerated Reinforcement Learning for Sentence Generation by Vocabulary Prediction,10.18653/v1/N19-1315,2
Corpus of Multimodal Interaction for Collaborative Planning,10.18653/v1/W19-1601,2
Content Differences in Syntactic and Semantic Representation,10.18653/v1/N19-1047,2
Phylogenic Multi-Lingual Dependency Parsing,10.18653/v1/N19-1017,2
Discontinuous Constituency Parsing with a Stack-Free Transition System and a Dynamic Oracle,10.18653/v1/N19-1018,2
Cross-lingual Annotation Projection Is Effective for Neural Part-of-Speech Tagging,10.18653/v1/W19-1425,2
Stance Detection in Code-Mixed Hindi-English Social Media Data using Multi-Task Learning,10.18653/v1/W19-1301,2
Ensemble Methods to Distinguish Mainland and Taiwan Chinese,10.18653/v1/W19-1417,1
SC-UPB at the VarDial 2019 Evaluation Campaign: Moldavian vs. Romanian Cross-Dialect Topic Identification,10.18653/v1/W19-1418,1
Improving Natural Language Interaction with Robots Using Advice,10.18653/v1/N19-1195,1
Learning to Stop in Structured Prediction for Neural Machine Translation,10.18653/v1/N19-1187,1
"Stance Classification, Outcome Prediction, and Impact Assessment: NLP Tasks for Studying Group Decision-Making",10.18653/v1/W19-2108,1
Cross-Topic Distributional Semantic Representations Via Unsupervised Mappings,10.18653/v1/N19-1110,1
Litigation Analytics: Case Outcomes Extracted from US Federal Court Dockets,10.18653/v1/W19-2206,1
Syntactic Interchangeability in Word Embedding Models,10.18653/v1/W19-2009,1
Using time series and natural language processing to identify viral moments in the 2016 U.S. Presidential Debate,10.18653/v1/W19-2107,1
Glocal: Incorporating Global Information in Local Convolution for Keyphrase Extraction,10.18653/v1/N19-1182,1
Context Dependent Semantic Parsing over Temporally Structured Data,10.18653/v1/N19-1360,1
Multi-Task Learning for Japanese Predicate Argument Structure Analysis,10.18653/v1/N19-1344,1
Neural Chinese Address Parsing,10.18653/v1/N19-1346,1
CITE: A Corpus of Image-Text Discourse Relations,10.18653/v1/N19-1056,1
Simple dynamic word embeddings for mapping perceptions in the public sphere,10.18653/v1/W19-2111,1
Modeling Acoustic-Prosodic Cues for Word Importance Prediction in Spoken Dialogues,10.18653/v1/W19-1702,1
Referring to Objects in Videos Using Spatio-Temporal Identifying Descriptions,10.18653/v1/W19-1802,1
Revisiting Visual Grounding,10.18653/v1/W19-1804,1
