Title,DOI,Citations
CLEVR-Dialog: A Diagnostic Dataset for Multi-Round Reasoning in Visual Dialog,10.18653/v1/N19-1058,1
Learning Outside the Box: Discourse-level Features Improve Metaphor Identification,10.18653/v1/N19-1059,1
Relation Discovery with Out-of-Relation Knowledge Base as Supervision,10.18653/v1/N19-1332,1
Improving Cross-Domain Chinese Word Segmentation with Word Embeddings,10.18653/v1/N19-1279,1
What do Entity-Centric Models Learn? Insights from Entity Linking in Multi-Party Dialogue,10.18653/v1/N19-1378,1
Top-Down Structurally-Constrained Neural Response Generation with Lexicalized Probabilistic Context-Free Grammar,10.18653/v1/N19-1377,1
Understanding the Behaviour of Neural Abstractive Summarizers using Contrastive Examples,10.18653/v1/N19-1396,1
NLP Whack-A-Mole: Challenges in Cross-Domain Temporal Expression Extraction,10.18653/v1/N19-1369,1
Combining Discourse Markers and Cross-lingual Embeddings for Synonym–Antonym Classification,10.18653/v1/N19-1390,1
Inferring missing metadata from environmental policy texts,10.18653/v1/W19-2506,1
ComQA: A Community-sourced Dataset for Complex Factoid Question Answering with Paraphrase Clusters,10.18653/v1/N19-1027,1
BAG: Bi-directional Attention Entity Graph Convolutional Network for Multi-hop Reasoning Question Answering,10.18653/v1/N19-1032,1
AutoSeM: Automatic Task Selection and Mixing in Multi-Task Learning,10.18653/v1/N19-1355,1
Subword-based Compact Reconstruction of Word Embeddings,10.18653/v1/N19-1353,1
Linguistically-Informed Specificity and Semantic Plausibility for Dialogue Generation,10.18653/v1/N19-1349,1
PoMo: Generating Entity-Specific Post-Modifiers in Context,10.18653/v1/N19-1089,1
ToNy: Contextual embeddings for accurate multilingual discourse segmentation of full documents,10.18653/v1/W19-2715,1
Multi-lingual and Cross-genre Discourse Unit Segmentation,10.18653/v1/W19-2714,1
Disentangling Language and Knowledge in Task-Oriented Dialogs,10.18653/v1/N19-1126,1
A Bag-of-concepts Model Improves Relation Extraction in a Narrow Knowledge Domain with Limited Data,10.18653/v1/N19-3007,1
Quantifiers in a Multimodal World: Hallucinating Vision with Language and Sound,10.18653/v1/W19-2912,1
Testing a Minimalist Grammar Parser on Italian Relative Clause Asymmetries,10.18653/v1/W19-2911,1
Toward a Computational Multidimensional Lexical Similarity Measure for Modeling Word Association Tasks in Psycholinguistics,10.18653/v1/W19-2908,1
Correcting Whitespace Errors in Digitized Historical Texts,10.18653/v1/W19-2513,1
SC-LSTM: Learning Task-Specific Representations in Multi-Task Learning for Sequence Labeling,10.18653/v1/N19-1249,1
Graph convolutional networks for exploring authorship hypotheses,10.18653/v1/W19-2510,1
The DISRPT 2019 Shared Task on Elementary Discourse Unit Segmentation and Connective Detection,10.18653/v1/W19-2713,1
The Strength of the Weakest Supervision: Topic Classification Using Class Labels,10.18653/v1/N19-3004,1
RST-Tace A tool for automatic comparison and evaluation of RST trees,10.18653/v1/W19-2712,1
Beyond The Wall Street Journal: Anchoring and Comparing Discourse Signals across Genres,10.18653/v1/W19-2710,1
Annotating Shallow Discourse Relations in Twitter Conversations,10.18653/v1/W19-2707,1
Entity Decisions in Neural Language Modelling: Approaches and Problems,10.18653/v1/W19-2803,1
Continuous Learning for Large-scale Personalized Domain Classification,10.18653/v1/N19-1379,1
Goal-Oriented End-to-End Conversational Models with Profile Features in a Real-World Setting,10.18653/v1/N19-2007,1
Conversation Initiation by Diverse News Contents Introduction,10.18653/v1/N19-1400,1
Lost in Interpretation: Predicting Untranslated Terminology in Simultaneous Interpretation,10.18653/v1/N19-1010,1
The importance of sharing patient-generated clinical speech and language data,10.18653/v1/W19-3007,1
"Generate, Filter, and Rank: Grammaticality Classification for Production-Ready NLG Systems",10.18653/v1/N19-2027,1
Measuring Immediate Adaptation Performance for Neural Machine Translation,10.18653/v1/N19-1206,1
Nuclearity in RST and signals of coherence relations,10.18653/v1/W19-2705,1
A Research Platform for Multi-Robot Dialogue with Humans,10.18653/v1/N19-4023,1
Chat-crowd: A Dialog-based Platform for Visual Layout Composition,10.18653/v1/N19-4024,1
Study of lexical aspect in the French medical language. Development of a lexical resource,10.18653/v1/W19-1907,1
A General-Purpose Annotation Model for Knowledge Discovery: Case Study in Spanish Clinical Text,10.18653/v1/W19-1910,1
Abbreviation Explorer - an interactive system for pre-evaluation of Unsupervised Abbreviation Disambiguation,10.18653/v1/N19-4001,1
SNAP-BATNET: Cascading Author Profiling and Social Network Graphs for Suicide Ideation Detection on Social Media,10.18653/v1/N19-3019,1
A Pregroup Representation of Word Order Alternation Using Hindi Syntax,10.18653/v1/N19-3017,1
Textual and Visual Characteristics of Mathematical Expressions in Scholar Documents,10.18653/v1/W19-2610,1
LeafNATS: An Open-Source Toolkit and Live Demo System for Neural Abstractive Text Summarization,10.18653/v1/N19-4012,1
"Train, Sort, Explain: Learning to Diagnose Translation Models",10.18653/v1/N19-4006,1
INS: An Interactive Chinese News Synthesis System,10.18653/v1/N19-4004,1
GumDrop at the DISRPT2019 Shared Task: A Model Stacking Approach to Discourse Unit Segmentation and Connective Detection,10.18653/v1/W19-2717,1
An Analysis of Deep Contextual Word Embeddings and Neural Architectures for Toponym Mention Detection in Scientific Publications,10.18653/v1/W19-2607,1
Deep Learning and Sociophonetics: Automatic Coding of Rhoticity Using Neural Networks,10.18653/v1/N19-3013,1
Gating Mechanisms for Combining Character and Word-level Word Representations: an Empirical Study,10.18653/v1/N19-3016,1
Community lexical access for an endangered polysynthetic language: An electronic dictionary for St. Lawrence Island Yupik,10.18653/v1/N19-4021,1
LT Expertfinder: An Evaluation Framework for Expert Finding Methods,10.18653/v1/N19-4017,1
Predicting Annotation Difficulty to Improve Task Routing and Model Performance for Biomedical Information Extraction,10.18653/v1/N19-1150,1
From legal to technical concept: Towards an automated classification of German political Twitter postings as criminal offenses,10.18653/v1/N19-1135,1
Factorising AMR generation through syntax,10.18653/v1/N19-1223,1
Fast Concept Mention Grouping for Concept Map-based Multi-Document Summarization,10.18653/v1/N19-1074,1
SEQˆ3: Differentiable Sequence-to-Sequence-to-Sequence Autoencoder for Unsupervised Abstractive Sentence Compression,10.18653/v1/N19-1071,1
"Frowning Frodo, Wincing Leia, and a Seriously Great Friendship: Learning to Classify Emotional Relationships of Fictional Characters",10.18653/v1/N19-1067,1
GAN Driven Semi-distant Supervision for Relation Extraction,10.18653/v1/N19-1307,1
A user study to compare two conversational assistants designed for people with hearing impairments,10.18653/v1/W19-1701,1
Online abuse detection: the value of preprocessing and neural attention models,10.18653/v1/W19-1303,1
Parallelizable Stack Long Short-Term Memory,10.18653/v1/W19-1501,1
Improving Human Text Comprehension through Semi-Markov CRF-based Neural Section Title Generation,10.18653/v1/N19-1168,1
TwistBytes - Identification of Cuneiform Languages and German Dialects at VarDial 2019,10.18653/v1/W19-1421,0
Neural Machine Translation between Myanmar (Burmese) and Rakhine (Arakanese),10.18653/v1/W19-1408,0
Toward a deep dialectological representation of Indo-Aryan,10.18653/v1/W19-1411,0
No Permanent Friends or Enemies: Tracking Relationships between Nations from News,10.18653/v1/N19-1167,0
A Soft Label Strategy for Target-Level Sentiment Classification,10.18653/v1/W19-1302,0
Comparing Pipelined and Integrated Approaches to Dialectal Arabic Neural Machine Translation,10.18653/v1/W19-1424,0
What a neural language model tells us about spatial relations,10.18653/v1/W19-1608,0
An Empirical Investigation of Global and Local Normalization for Recurrent Neural Sequence Models Using a Continuous Relaxation to Beam Search,10.18653/v1/N19-1171,0
Structured Minimally Supervised Learning for Neural Relation Extraction,10.18653/v1/N19-1310,0
Serial Recall Effects in Neural Language Modeling,10.18653/v1/N19-1073,0
GenderQuant: Quantifying Mention-Level Genderedness,10.18653/v1/N19-1303,0
Fact Discovery from Knowledge Base via Facet Decomposition,10.18653/v1/N19-1297,0
Litigation Analytics: Extracting and querying motions and orders from US federal courts,10.18653/v1/N19-4020,0
SkillBot: Towards Automatic Skill Development via User Demonstration,10.18653/v1/N19-4018,0
iComposer: An Automatic Songwriting System for Chinese Popular Music,10.18653/v1/N19-4015,0
Browsing Health: Information Extraction to Support New Interfaces for Accessing Medical Evidence,10.18653/v1/W19-2606,0
Annotating with Pros and Cons of Technologies in Computer Science Papers,10.18653/v1/W19-2605,0
Vector of Locally Aggregated Embeddings for Text Representation,10.18653/v1/N19-1143,0
Adaptation of Hierarchical Structured Models for Speech Act Recognition in Asynchronous Conversation,10.18653/v1/N19-1134,0
Harry Potter and the Action Prediction Challenge from Natural Language,10.18653/v1/N19-1218,0
Extracting Factual Min/Max Age Information from Clinical Trial Studies,10.18653/v1/W19-1914,0
Annotating and Characterizing Clinical Sentences with Explicit Why-QA Cues,10.18653/v1/W19-1913,0
Predicting ICU transfers using text messages between nurses and doctors,10.18653/v1/W19-1911,0
Contextualization of Morphological Inflection,10.18653/v1/N19-1203,0
Clinical Data Classification using Conditional Random Fields and Neural Parsing for Morphologically Rich Languages,10.18653/v1/W19-1919,0
From News to Medical: Cross-domain Discourse Segmentation,10.18653/v1/W19-2704,0
Acquiring Annotated Data with Cross-lingual Explicitation for Implicit Discourse Relation Classification,10.18653/v1/W19-2703,0
Computational Investigations of Pragmatic Effects in Natural Language,10.18653/v1/N19-3010,0
A Partially Rule-Based Approach to AMR Generation,10.18653/v1/N19-3009,0
Language Learning and Processing in People and Machines,10.18653/v1/N19-5005,0
Measuring and Modeling Language Change,10.18653/v1/N19-5003,0
Visualizing Inferred Morphotactic Systems,10.18653/v1/N19-4022,0
Using Rhetorical Structure Theory to Assess Discourse Coherence for Non-native Spontaneous Speech,10.18653/v1/W19-2719,0
Towards discourse annotation and sentiment analysis of the Basque Opinion Corpus,10.18653/v1/W19-2718,0
Learning to Respond to Mixed-code Queries using Bilingual Word Embeddings,10.18653/v1/N19-4005,0
Enabling Search and Collaborative Assembly of Causal Interactions Extracted from Multilingual and Multi-domain Free Text,10.18653/v1/N19-4003,0
Toward Cross-theory Discourse Relation Annotation,10.18653/v1/W19-2702,0
Playing by the Book: An Interactive Game Approach for Action Graph Extraction from Text,10.18653/v1/W19-2609,0
STAC: Science Toolkit Based on Chinese Idiom Knowledge Graph,10.18653/v1/W19-2608,0
Surprisal and Interference Effects of Case Markers in Hindi Word Order,10.18653/v1/W19-2904,0
Computational Linguistics for Enhancing Scientific Reproducibility and Reducing Healthcare Inequities,10.18653/v1/W19-3011,0
TOI-CNN: a Solution of Information Extraction on Chinese Insurance Policy,10.18653/v1/N19-2022,0
A k-Nearest Neighbor Approach towards Multi-level Sequence Labeling,10.18653/v1/N19-2019,0
Improving Knowledge Base Construction from Robust Infobox Extraction,10.18653/v1/N19-2018,0
Doc2hash: Learning Discrete Latent variables for Documents Retrieval,10.18653/v1/N19-1232,0
AttentiveChecker: A Bi-Directional Attention Flow Mechanism for Fact Verification,10.18653/v1/N19-1230,0
On the Idiosyncrasies of the Mandarin Chinese Classifier System,10.18653/v1/N19-1415,0
Benchmarking Hierarchical Script Knowledge,10.18653/v1/N19-1412,0
Saliency Learning: Teaching the Model Where to Pay Attention,10.18653/v1/N19-1404,0
Multilingual segmentation based on neural networks and pre-trained word embeddings,10.18653/v1/W19-2716,0
EusDisParser: improving an under-resourced discourse parser with cross-lingual data,10.18653/v1/W19-2709,0
A Discourse Signal Annotation System for RST Trees,10.18653/v1/W19-2708,0
Detecting Derogatory Compounds – An Unsupervised Approach,10.18653/v1/N19-1211,0
Cross-lingual CCG Induction,10.18653/v1/N19-1160,0
Analyzing Bayesian Crosslingual Transfer in Topic Models,10.18653/v1/N19-1158,0
Quantifying the morphosyntactic content of Brown Clusters,10.18653/v1/N19-1157,0
Cross-lingual Incongruences in the Annotation of Coreference,10.18653/v1/W19-2805,0
Using Grounded Word Representations to Study Theories of Lexical Concepts,10.18653/v1/W19-2918,0
Neural Models of the Psychosemantics of ‘Most’,10.18653/v1/W19-2916,0
Using Natural Language Relations between Answer Choices for Machine Comprehension,10.18653/v1/N19-1403,0
The Lower The Simpler: Simplifying Hierarchical Recurrent Models,10.18653/v1/N19-1402,0
Are the Tools up to the Task? an Evaluation of Commercial Dialog Tools in Developing Conversational Enterprise-grade Dialog Systems,10.18653/v1/N19-2014,0
Enabling Real-time Neural IME with Incremental Vocabulary Selection,10.18653/v1/N19-2001,0
Data Augmentation for Context-Sensitive Neural Lemmatization Using Inflection Tables and Raw Text,10.18653/v1/N19-1418,0
A Framework for Decoding Event-Related Potentials from Text,10.18653/v1/W19-2910,0
Modeling Long-Distance Cue Integration in Spoken Word Recognition,10.18653/v1/W19-2907,0
A Modeling Study of the Effects of Surprisal and Entropy in Perceptual Decision Making of an Adaptive Agent,10.18653/v1/W19-2906,0
Not My President: How Names and Titles Frame Political Figures,10.18653/v1/W19-2101,0
Sign Clustering and Topic Extraction in Proto-Elamite,10.18653/v1/W19-2516,0
The limits of Spanglish?,10.18653/v1/W19-2515,0
Computational Linguistics Applications for Multimedia Services,10.18653/v1/W19-2512,0
Revisiting NMT for Normalization of Early English Letters,10.18653/v1/W19-2509,0
A framework for streamlined statistical prediction using topic models,10.18653/v1/W19-2508,0
CCG Parsing Algorithm with Incremental Tree Rotation,10.18653/v1/N19-1020,0
How Bad are PoS Tagger in Cross-Corpora Settings? Evaluating Annotation Divergence in the UD Project.,10.18653/v1/N19-1019,0
Unsupervised Extraction of Partial Translations for Neural Machine Translation,10.18653/v1/N19-1384,0
The problem with probabilistic DAG automata for semantic graphs,10.18653/v1/N19-1096,0
Implementation of a Chomsky-Schützenberger n-best parser for weighted multiple context-free grammars,10.18653/v1/N19-1016,0
A Grounded Unsupervised Universal Part-of-Speech Tagger for Low-Resource Languages,10.18653/v1/N19-1252,0
Casting Light on Invisible Cities: Computationally Engaging with Literary Criticism,10.18653/v1/N19-1130,0
Decay-Function-Free Time-Aware Attention to Context and Speaker Indicator for Spoken Language Understanding,10.18653/v1/N19-1372,0
Cross-referencing Using Fine-grained Topic Modeling,10.18653/v1/N19-1399,0
News Article Teaser Tweets and How to Generate Them,10.18653/v1/N19-1398,0
Neural Finite-State Transducers: Beyond Rational Relations,10.18653/v1/N19-1024,0
Recurrent models and lower bounds for projective syntactic decoding,10.18653/v1/N19-1022,0
VQD: Visual Query Detection In Natural Scenes,10.18653/v1/N19-1194,0
Value-based Search in Execution Space for Mapping Instructions to Programs,10.18653/v1/N19-1193,0
A Study of Latent Structured Prediction Approaches to Passage Reranking,10.18653/v1/N19-1183,0
Bayesian Learning for Neural Dependency Parsing,10.18653/v1/N19-1354,0
DiscoFuse: A Large-Scale Dataset for Discourse-Based Sentence Fusion,10.18653/v1/N19-1348,0
The World in My Mind: Visual Dialog with Adversarial Multi-modal Feature Encoding,10.18653/v1/N19-1266,0
Data-efficient Neural Text Compression with Interactive Learning,10.18653/v1/N19-1262,0
Automatic learner summary assessment for reading comprehension,10.18653/v1/N19-1261,0
What just happened? Evaluating retrofitted distributional word vectors,10.18653/v1/N19-1111,0
Word-Node2Vec: Improving Word Embedding with Document-Level Non-Local Word Co-occurrences,10.18653/v1/N19-1109,0
Bridging the Gap: Attending to Discontinuity in Identification of Multiword Expressions,10.18653/v1/N19-1275,0
Understanding and Improving Hidden Representations for Neural Machine Translation,10.18653/v1/N19-1046,0
Aligning Vector-spaces with Noisy Supervised Lexicon,10.18653/v1/N19-1045,0
ReWE: Regressing Word Embeddings for Regularization of Neural Machine Translation Systems,10.18653/v1/N19-1041,0
Modeling performance differences on cognitive tests using LSTMs and skip-thought vectors trained on reported media consumption.,10.18653/v1/W19-2106,0
Neural Network Prediction of Censorable Language,10.18653/v1/W19-2105,0
Multi-Context Term Embeddings: the Use Case of Corpus-based Term Set Expansion,10.18653/v1/W19-2013,0
Dyr Bul Shchyl. Proxying Sound Symbolism With Word Embeddings,10.18653/v1/W19-2012,0
Asking the Right Question: Inferring Advice-Seeking Intentions from Personal Narratives,10.18653/v1/N19-1052,0
Customizing Grapheme-to-Phoneme System for Non-Trivial Transcription Problems in Bangla Language,10.18653/v1/N19-1322,0
Posterior-regularized REINFORCE for Instance Selection in Distant Supervision,10.18653/v1/N19-1290,0
Shrinking Japanese Morphological Analyzers With Neural Networks and Semi-supervised Learning,10.18653/v1/N19-1281,0
Neural Semi-Markov Conditional Random Fields for Robust Character-Based Part-of-Speech Tagging,10.18653/v1/N19-1280,0
VCWE: Visual Character-Enhanced Word Embeddings,10.18653/v1/N19-1277,0
Learning from Implicit Information in Natural Language Instructions for Robotic Manipulations,10.18653/v1/W19-1604,0
From Virtual to Real: A Framework for Verbal Interaction with Robots,10.18653/v1/W19-1603,0
¿Es un plátano? Exploring the Application of a Physically Grounded Language Acquisition System to Spanish,10.18653/v1/W19-1602,0
Transferable Neural Projection Representations,10.18653/v1/N19-1339,0
Using Large Corpus N-gram Statistics to Improve Recurrent Neural Language Models,10.18653/v1/N19-1330,0
Segmentation-free compositional n-gram embedding,10.18653/v1/N19-1324,0
Combining Sentiment Lexica with a Multi-View Variational Autoencoder,10.18653/v1/N19-1065,0
Measuring Semantic Abstraction of Multilingual NMT with Paraphrase Recognition and Generation Tasks,10.18653/v1/W19-2005,0
Naive Bayes and BiLSTM Ensemble for Discriminating between Mainland and Taiwan Variation of Mandarin Chinese,10.18653/v1/W19-1412,0
Deep Natural Language Understanding of News Text,10.18653/v1/W19-2403,0
Char-RNN for Word Stress Detection in East Slavic Languages,10.18653/v1/W19-1404,0
Noisy Neural Language Modeling for Typing Prediction in BCI Communication,10.18653/v1/W19-1707,0
Investigating Speech Recognition for Improving Predictive AAC,10.18653/v1/W19-1706,0
A Blissymbolics Translation System,10.18653/v1/W19-1705,0
Grounded Word Sense Translation,10.18653/v1/W19-1808,0
SPARSE: Structured Prediction using Argument-Relative Structured Encoding,10.18653/v1/W19-1503,0
Neural and Linear Pipeline Approaches to Cross-lingual Morphological Analysis,10.18653/v1/W19-1416,0
Initial Experiments In Cross-Lingual Morphological Analysis Using Morpheme Segmentation,10.18653/v1/W19-1415,0
The R2I_LIS Team Proposes Majority Vote for VarDial’s MRC Task,10.18653/v1/W19-1414,0
BAM: A combination of deep and shallow models for German Dialect Identification.,10.18653/v1/W19-1413,0
