Title,DOI,Citations
BERT: Pre-training of Deep Bidirectional Transformers for Language Understanding,10.18653/v1/N19-1423,2285
Publicly Available Clinical BERT Embeddings,10.18653/v1/W19-1909,616
"fairseq: A Fast, Extensible Toolkit for Sequence Modeling",10.18653/v1/N19-4009,513
Transfer Learning in Natural Language Processing,10.18653/v1/N19-5004,238
Predicting the Type and Target of Offensive Posts in Social Media,10.18653/v1/N19-1144,189
A Capsule Network-based Embedding Model for Knowledge Graph Completion and Search Personalization,10.18653/v1/N19-1226,136
End-to-End Open-Domain Question Answering with BERTserini,10.18653/v1/N19-4013,125
A general framework for information extraction using dynamic span graphs,10.18653/v1/N19-1308,111
Long-tail Relation Extraction via Knowledge Graph Embeddings and Graph Convolution Networks,10.18653/v1/N19-1306,97
Learning to Navigate Unseen Environments: Back Translation with Environmental Dropout,10.18653/v1/N19-1268,97
Linguistic Knowledge and Transferability of Contextual Representations,10.18653/v1/N19-1112,95
Graph Convolution for Multimodal Information Extraction from Visually Rich Documents,10.18653/v1/N19-2005,95
Star-Transformer,10.18653/v1/N19-1133,89
Target-oriented Opinion Words Extraction with Target-fused Neural Sequence Labeling,10.18653/v1/N19-1259,89
Multi-task Learning for Multi-modal Emotion Recognition and Sentiment Analysis,10.18653/v1/N19-1034,88
Pooled Contextualized Embeddings for Named Entity Recognition,10.18653/v1/N19-1078,88
Competence-based Curriculum Learning for Neural Machine Translation,10.18653/v1/N19-1119,82
Cyclical Annealing Schedule: A Simple Approach to Mitigating KL Vanishing,10.18653/v1/N19-1021,79
On Measuring Social Biases in Sentence Encoders,10.18653/v1/N19-1063,78
Structural Scaffolds for Citation Intent Classification in Scientific Publications,10.18653/v1/N19-1361,74
Black is to Criminal as Caucasian is to Police: Detecting and Removing Multiclass Bias in Word Embeddings,10.18653/v1/N19-1062,72
Gender Bias in Contextualized Word Embeddings,10.18653/v1/N19-1064,71
Adaptive Convolution for Multi-Relational Learning,10.18653/v1/N19-1103,71
Bidirectional Attentive Memory Networks for Question Answering over Knowledge Bases,10.18653/v1/N19-1299,66
Adversarial Training for Weakly Supervised Event Detection,10.18653/v1/N19-1105,63
Massively Multilingual Neural Machine Translation,10.18653/v1/N19-1388,62
FLAIR: An Easy-to-Use Framework for State-of-the-Art NLP,10.18653/v1/N19-4010,58
Improving Grammatical Error Correction via Pre-Training a Copy-Augmented Architecture with Unlabeled Data,10.18653/v1/N19-1014,56
Distant Supervision Relation Extraction with Intra-Bag and Inter-Bag Attentions,10.18653/v1/N19-1288,55
Cross-lingual Transfer Learning for Multilingual Task Oriented Dialog,10.18653/v1/N19-1380,55
Lipstick on a Pig: Debiasing Methods Cover up Systematic Gender Biases in Word Embeddings But do not Remove Them,10.18653/v1/N19-1061,55
Question Answering by Reasoning Across Documents with Graph Convolutional Networks,10.18653/v1/N19-1240,54
Convolutional Self-Attention Networks,10.18653/v1/N19-1407,53
Recommendations for Datasets for Source Code Summarization,10.18653/v1/N19-1394,53
Learning Hierarchical Discourse-level Structure for Fake News Detection,10.18653/v1/N19-1347,53
BERT Post-Training for Review Reading Comprehension and Aspect-based Sentiment Analysis,10.18653/v1/N19-1242,52
Identifying and Reducing Gender Bias in Word-Level Language Models,10.18653/v1/N19-3002,49
Integrating Semantic Knowledge to Tackle Zero-shot Text Classification,10.18653/v1/N19-1108,48
CLPsych 2019 Shared Task: Predicting the Degree of Suicide Risk in Reddit Posts,10.18653/v1/W19-3003,47
Detecting Depression in Social Media using Fine-Grained Emotions,10.18653/v1/N19-1151,47
A Structural Probe for Finding Syntax in Word Representations,10.18653/v1/N19-1419,46
Suicide Risk Assessment with Multi-level Dual-Context Language and BERT,10.18653/v1/W19-3005,43
Document-Level N-ary Relation Extraction with Multiscale Representation Learning,10.18653/v1/N19-1370,42
Rethinking Complex Neural Network Architectures for Document Classification,10.18653/v1/N19-1408,41
Enhancing Key-Value Memory Neural Networks for Knowledge Based Question Answering,10.18653/v1/N19-1301,40
Analyzing Polarization in Social Media: Method and Application to Tweets on 21 Mass Shootings,10.18653/v1/N19-1304,40
Old is Gold: Linguistic Driven Approach for Entity and Relation Linking of Short Text,10.18653/v1/N19-1243,39
Probing the Need for Visual Context in Multimodal Machine Translation,10.18653/v1/N19-1422,38
Semantically-Aligned Equation Generation for Solving and Reasoning Math Word Problems,10.18653/v1/N19-1272,38
Pre-training on high-resource speech recognition improves low-resource speech-to-text translation,10.18653/v1/N19-1006,37
An Encoding Strategy Based Word-Character LSTM for Chinese NER,10.18653/v1/N19-1247,37
Selective Attention for Context-aware Neural Machine Translation,10.18653/v1/N19-1313,37
Pre-trained language model representations for language generation,10.18653/v1/N19-1409,36
Joint Multiple Intent Detection and Slot Labeling for Goal-Oriented Dialog,10.18653/v1/N19-1055,35
Probing Biomedical Embeddings from Language Models,10.18653/v1/W19-2011,35
An Embarrassingly Simple Approach for Transfer Learning from Pretrained Language Models,10.18653/v1/N19-1213,35
Utilizing BERT for Aspect-Based Sentiment Analysis via Constructing Auxiliary Sentence,10.18653/v1/N19-1035,34
Affect-Driven Dialog Generation,10.18653/v1/N19-1374,33
Better Modeling of Incomplete Annotations for Named Entity Recognition,10.18653/v1/N19-1079,33
A BERT-based Universal Model for Both Within- and Cross-sentence Clinical Temporal Relation Extraction,10.18653/v1/W19-1908,33
Corpora Generation for Grammatical Error Correction,10.18653/v1/N19-1333,33
Incorporating Emoji Descriptions Improves Tweet Classification,10.18653/v1/N19-1214,32
What makes a good conversation? How controllable attributes affect human judgments,10.18653/v1/N19-1170,32
Early Rumour Detection,10.18653/v1/N19-1163,32
Massively Multilingual Adversarial Speech Recognition,10.18653/v1/N19-1009,31
Single Document Summarization as Tree Induction,10.18653/v1/N19-1173,31
"Cross-Lingual Alignment of Contextual Word Embeddings, with Applications to Zero-shot Dependency Parsing",10.18653/v1/N19-1162,31
Attention is not Explanation,10.18653/v1/N19-1357,31
Improving Machine Reading Comprehension with General Reading Strategies,10.18653/v1/N19-1270,30
A Survey on Biomedical Image Captioning,10.18653/v1/W19-1803,28
Unifying Human and Statistical Evaluation for Natural Language Generation,10.18653/v1/N19-1169,28
Modeling Recurrence for Transformer,10.18653/v1/N19-1122,28
On Evaluation of Adversarial Perturbations for Sequence-to-Sequence Models,10.18653/v1/N19-1314,27
Neural language models as psycholinguistic subjects: Representations of syntactic state,10.18653/v1/N19-1004,27
Curriculum Learning for Domain Adaptation in Neural Machine Translation,10.18653/v1/N19-1189,27
Sentence Embedding Alignment for Lifelong Relation Extraction,10.18653/v1/N19-1086,26
Positional Encoding to Control Output Sequence Length,10.18653/v1/N19-1401,26
Reinforcement Learning Based Text Style Transfer without Parallel Training Corpus,10.18653/v1/N19-1320,26
Argument Mining for Understanding Peer Reviews,10.18653/v1/N19-1219,25
Medical Entity Linking using Triplet Network,10.18653/v1/W19-1912,25
Extreme Multi-Label Legal Text Classification: A Case Study in EU Legislation,10.18653/v1/W19-2209,24
The emergence of number and syntax units in LSTM language models,10.18653/v1/N19-1002,24
Analyzing the Perceived Severity of Cybersecurity Threats Reported on Social Media,10.18653/v1/N19-1140,24
Investigating Robustness and Interpretability of Link Prediction via Adversarial Modifications,10.18653/v1/N19-1337,23
Modeling Document-level Causal Structures for Event Causal Relation Identification,10.18653/v1/N19-1179,23
Topic-Guided Variational Auto-Encoder for Text Generation,10.18653/v1/N19-1015,23
Hierarchical User and Item Representation with Three-Tier Attention for Recommendation,10.18653/v1/N19-1180,22
Overcoming Catastrophic Forgetting During Domain Adaptation of Neural Machine Translation,10.18653/v1/N19-1209,22
Submodular Optimization-based Diverse Paraphrasing and its Effectiveness in Data Augmentation,10.18653/v1/N19-1363,22
"Adversarial Regularization for Visual Question Answering: Strengths, Shortcomings, and Side Effects",10.18653/v1/W19-1801,22
Syntax-Enhanced Neural Machine Translation with Syntax-Aware Word Representations,10.18653/v1/N19-1118,22
Let’s Make Your Request More Persuasive: Modeling Persuasive Strategies via Semi-Supervised Neural Nets on Crowdfunding Platforms,10.18653/v1/N19-1364,21
Adversarial Category Alignment Network for Cross-domain Sentiment Classification,10.18653/v1/N19-1258,21
Biomedical Event Extraction based on Knowledge-driven Tree-LSTM,10.18653/v1/N19-1145,21
White-to-Black: Efficient Distillation of Black-Box Adversarial Attacks,10.18653/v1/N19-1139,21
Enhancing the Measurement of Social Effects by Capturing Morality,10.18653/v1/W19-1305,21
Event Detection without Triggers,10.18653/v1/N19-1080,21
Text Processing Like Humans Do: Visually Attacking and Shielding NLP Systems,10.18653/v1/N19-1165,20
Repurposing Entailment for Multi-Hop Question Answering Tasks,10.18653/v1/N19-1302,20
Rethinking Action Spaces for Reinforcement Learning in End-to-end Dialog Agents with Latent Variable Models,10.18653/v1/N19-1123,19
Courteously Yours: Inducing courteous behavior in Customer Care responses using Reinforced Pointer Generator Network,10.18653/v1/N19-1091,19
Sentence Boundary Detection in Legal Text,10.18653/v1/W19-2204,19
Something’s Brewing! Early Prediction of Controversy-causing Posts from Discussion Features,10.18653/v1/N19-1166,19
Linguistic Analysis of Schizophrenia in Reddit Posts,10.18653/v1/W19-3009,18
A Novel System for Extractive Clinical Note Summarization using EHR Data,10.18653/v1/W19-1906,18
Does My Rebuttal Matter? Insights from a Major NLP Conference,10.18653/v1/N19-1129,18
Simple Question Answering with Subgraph Ranking and Joint-Scoring,10.18653/v1/N19-1029,18
"BERT has a Mouth, and It Must Speak: BERT as a Markov Random Field Language Model",10.18653/v1/W19-2304,17
Skeleton-to-Response: Dialogue Generation Guided by Retrieval Memory,10.18653/v1/N19-1124,17
Non-Parametric Adaptation for Neural Machine Translation,10.18653/v1/N19-1191,17
Using Similarity Measures to Select Pretraining Data for NER,10.18653/v1/N19-1149,17
Improved Lexically Constrained Decoding for Translation and Monolingual Rewriting,10.18653/v1/N19-1090,17
"Speak up, Fight Back! Detection of Social Media Disclosures of Sexual Harassment",10.18653/v1/N19-3018,17
Neural Text Normalization with Subword Units,10.18653/v1/N19-2024,17
Box of Lies: Multimodal Deception Detection in Dialogues,10.18653/v1/N19-1175,17
Multi-task Learning with Sample Re-weighting for Machine Reading Comprehension,10.18653/v1/N19-1271,16
Jointly Optimizing Diversity and Relevance in Neural Response Generation,10.18653/v1/N19-1125,16
Shifting the Baseline: Single Modality Performance on Visual Navigation & QA,10.18653/v1/N19-1197,16
CommonsenseQA: A Question Answering Challenge Targeting Commonsense Knowledge,10.18653/v1/N19-1421,16
Evaluating Style Transfer for Text,10.18653/v1/N19-1049,16
Detection of Abusive Language: the Problem of Biased Datasets,10.18653/v1/N19-1060,16
A Robust Abstractive System for Cross-Lingual Summarization,10.18653/v1/N19-1204,16
Reinforcement Learning based Curriculum Optimization for Neural Machine Translation,10.18653/v1/N19-1208,16
Medical Word Embeddings for Spanish: Development and Evaluation,10.18653/v1/W19-1916,15
Evaluating Coherence in Dialogue Systems using Entailment,10.18653/v1/N19-1381,15
Knowledge-Augmented Language Model and Its Application to Unsupervised Named-Entity Recognition,10.18653/v1/N19-1117,15
Complexity-Weighted Loss and Diverse Reranking for Sentence Simplification,10.18653/v1/N19-1317,15
On Difficulties of Cross-Lingual Transfer with Order Differences: A Case Study on Dependency Parsing,10.18653/v1/N19-1253,15
Correlation Coefficients and Semantic Textual Similarity,10.18653/v1/N19-1100,15
Better Automatic Evaluation of Open-Domain Dialogue Systems with Contextualized Embeddings,10.18653/v1/W19-2310,15
Distinguishing Clinical Sentiment: The Importance of Domain Adaptation in Psychiatric Patient Health Records,10.18653/v1/W19-1915,15
BoolQ: Exploring the Surprising Difficulty of Natural Yes/No Questions,10.18653/v1/N19-1300,14
A Silver Standard Corpus of Human Phenotype-Gene Relations,10.18653/v1/N19-1152,14
Detecting Customer Complaint Escalation with Recurrent Neural Networks and Manually-Engineered Features,10.18653/v1/N19-2008,14
DROP: A Reading Comprehension Benchmark Requiring Discrete Reasoning Over Paragraphs,10.18653/v1/N19-1246,14
Unsupervised Latent Tree Induction with Deep Inside-Outside Recursive Auto-Encoders,10.18653/v1/N19-1116,13
Misspelling Oblivious Word Embeddings,10.18653/v1/N19-1326,13
Microblog Hashtag Generation via Encoding Conversation Contexts,10.18653/v1/N19-1164,13
Imposing Label-Relational Inductive Bias for Extremely Fine-Grained Entity Typing,10.18653/v1/N19-1084,13
Better Word Embeddings by Disentangling Contextual n-Gram Information,10.18653/v1/N19-1098,13
Mental Health Surveillance over Social Media with Digital Cohorts,10.18653/v1/W19-3013,13
A Large-Scale Comparison of Historical Text Normalization Systems,10.18653/v1/N19-1389,13
“President Vows to Cut <Taxes> Hair”: Dataset and Analysis of Creative Text Editing for Humorous Headlines,10.18653/v1/N19-1012,13
Jointly Extracting and Compressing Documents with Summary State Representations,10.18653/v1/N19-1397,13
An Investigation of Deep Learning Systems for Suicide Risk Assessment,10.18653/v1/W19-3023,13
Playing Text-Adventure Games with Graph-Based Deep Reinforcement Learning,10.18653/v1/N19-1358,12
Learning to Describe Unknown Phrases with Local and Global Contexts,10.18653/v1/N19-1350,12
Connecting Language and Knowledge with Heterogeneous Representations for Neural Relation Extraction,10.18653/v1/N19-1323,12
Addressing word-order Divergence in Multilingual Neural Machine Translation for extremely Low Resource Languages,10.18653/v1/N19-1387,12
Evaluating and Enhancing the Robustness of Dialogue Systems: A Case Study on a Negotiation Agent,10.18653/v1/N19-1336,12
“When Numbers Matter!”: Detecting Sarcasm in Numerical Portions of Text,10.18653/v1/W19-1309,12
Identifying therapist conversational actions across diverse psychotherapeutic approaches,10.18653/v1/W19-3002,12
Deep Learning Techniques for Humor Detection in Hindi-English Code-Mixed Tweets,10.18653/v1/W19-1307,12
Text Similarity Estimation Based on Word Embeddings and Matrix Norms for Targeted Marketing,10.18653/v1/N19-1181,12
Online Distilling from Checkpoints for Neural Machine Translation,10.18653/v1/N19-1192,12
An Integrated Approach for Keyphrase Generation via Exploring the Power of Retrieval and Extraction,10.18653/v1/N19-1292,12
"Beyond task success: A closer look at jointly learning to see, ask, and GuessWhat",10.18653/v1/N19-1265,12
Improving Event Coreference Resolution by Learning Argument Compatibility from Unlabeled Data,10.18653/v1/N19-1085,12
Detecting Cybersecurity Events from Noisy Short Text,10.18653/v1/N19-1138,12
In Other News: a Bi-style Text-to-speech Model for Synthesizing Newscaster Voice with Limited Data,10.18653/v1/N19-2026,12
Attention Neural Model for Temporal Relation Extraction,10.18653/v1/W19-1917,11
Entity Recognition at First Sight: Improving NER with Eye Movement Information,10.18653/v1/N19-1001,11
Scaling Multi-Domain Dialogue State Tracking via Query Reformulation,10.18653/v1/N19-2013,11
Train One Get One Free: Partially Supervised Neural Network for Bug Report Duplicate Detection and Clustering,10.18653/v1/N19-2020,11
Inoculation by Fine-Tuning: A Method for Analyzing Challenge Datasets,10.18653/v1/N19-1225,11
Multi-Task Ordinal Regression for Jointly Predicting the Trustworthiness and the Leading Political Ideology of News Media,10.18653/v1/N19-1216,11
Multi-Channel Convolutional Neural Network for Twitter Emotion and Sentiment Recognition,10.18653/v1/N19-1137,11
Combining Distant and Direct Supervision for Neural Relation Extraction,10.18653/v1/N19-1184,11
Outlier Detection for Improved Data Quality and Diversity in Dialog Systems,10.18653/v1/N19-1051,11
Seeing Things from a Different Angle:Discovering Diverse Perspectives about Claims,10.18653/v1/N19-1053,11
Unsupervised Recurrent Neural Network Grammars,10.18653/v1/N19-1114,11
Text Generation with Exemplar-based Adaptive Decoding,10.18653/v1/N19-1263,11
Learning When Not to Answer: a Ternary Reward Structure for Reinforcement Learning Based Question Answering,10.18653/v1/N19-2016,11
Description-Based Zero-shot Fine-Grained Entity Typing,10.18653/v1/N19-1087,11
Incorporating Word Attention into Character-Based Word Segmentation,10.18653/v1/N19-1276,10
Iterative Search for Weakly Supervised Semantic Parsing,10.18653/v1/N19-1273,10
Viable Dependency Parsing as Sequence Labeling,10.18653/v1/N19-1077,10
Sub-event detection from twitter streams as a sequence labeling problem,10.18653/v1/N19-1081,10
Improving Lemmatization of Non-Standard Languages with Joint Learning,10.18653/v1/N19-1153,10
Learning to Denoise Distantly-Labeled Data for Entity Typing,10.18653/v1/N19-1250,10
Emotion Impacts Speech Recognition Performance,10.18653/v1/N19-3003,10
Legal Area Classification: A Comparative Study of Text Classifiers on Singapore Supreme Court Judgments,10.18653/v1/W19-2208,10
Question Answering as an Automatic Evaluation Metric for News Article Summarization,10.18653/v1/N19-1395,10
Attentive Mimicking: Better Word Embeddings by Attending to Informative Contexts,10.18653/v1/N19-1048,10
Inferring Which Medical Treatments Work from Reports of Clinical Trials,10.18653/v1/N19-1371,10
Vector of Locally-Aggregated Word Embeddings (VLAWE): A Novel Document-level Representation,10.18653/v1/N19-1033,10
Jointly Measuring Diversity and Quality in Text Generation Models,10.18653/v1/W19-2311,10
Multi-modal Discriminative Model for Vision-and-Language Navigation,10.18653/v1/W19-1605,10
Information Aggregation for Multi-Head Attention with Routing-by-Agreement,10.18653/v1/N19-1359,10
What’s in a Name? Reducing Bias in Bios without Access to Protected Attributes,10.18653/v1/N19-1424,10
Guiding Extractive Summarization with Question-Answering Rewards,10.18653/v1/N19-1264,10
compare-mt: A Tool for Holistic Comparison of Language Generation Systems,10.18653/v1/N19-4007,9
Pragmatically Informative Text Generation,10.18653/v1/N19-1410,9
Giving Attention to the Unexpected: Using Prosody Innovations in Disfluency Detection,10.18653/v1/N19-1008,9
Context-Aware Cross-Lingual Mapping,10.18653/v1/N19-1391,9
Mining Discourse Markers for Unsupervised Sentence Representation Learning,10.18653/v1/N19-1351,9
Joint Multi-Label Attention Networks for Social Text Annotation,10.18653/v1/N19-1136,9
Short-Term Meaning Shift: A Distributional Exploration,10.18653/v1/N19-1210,9
Relation Extraction using Explicit Context Conditioning,10.18653/v1/N19-1147,9
How do we feel when a robot dies? Emotions expressed on Twitter before and after hitchBOT’s destruction,10.18653/v1/W19-1308,9
Alignment over Heterogeneous Embeddings for Question Answering,10.18653/v1/N19-1274,9
A Dynamic Speaker Model for Conversational Interactions,10.18653/v1/N19-1284,9
Evaluating Rewards for Question Generation Models,10.18653/v1/N19-1237,9
Strong and Simple Baselines for Multimodal Utterance Embeddings,10.18653/v1/N19-1267,9
Document-Level Event Factuality Identification via Adversarial Neural Network,10.18653/v1/N19-1287,9
Ranking-Based Autoencoder for Extreme Multi-label Classification,10.18653/v1/N19-1289,9
Generalizing Unmasking for Short Texts,10.18653/v1/N19-1068,9
Adversarial Training for Satire Detection: Controlling for Confounding Variables,10.18653/v1/N19-1069,9
Dataset Mention Extraction and Classification,10.18653/v1/W19-2604,8
Semantic Characteristics of Schizophrenic Speech,10.18653/v1/W19-3010,8
Coherence models in schizophrenia,10.18653/v1/W19-3015,8
Towards Automatic Generation of Shareable Synthetic Clinical Notes Using Neural Language Models,10.18653/v1/W19-1905,8
pair2vec: Compositional Word-Pair Embeddings for Cross-Sentence Inference,10.18653/v1/N19-1362,8
Understanding Dataset Design Choices for Multi-hop Reasoning,10.18653/v1/N19-1405,8
Neural Grammatical Error Correction with Finite State Transducers,10.18653/v1/N19-1406,8
Multi-Modal Generative Adversarial Network for Short Product Title Generation in Mobile E-Commerce,10.18653/v1/N19-2009,8
A large-scale study of the effects of word frequency and predictability in naturalistic reading,10.18653/v1/N19-1413,8
Polyglot Contextual Representations Improve Crosslingual Transfer,10.18653/v1/N19-1392,8
"Plan, Write, and Revise: an Interactive System for Open-Domain Story Generation",10.18653/v1/N19-4016,8
Predicting Helpful Posts in Open-Ended Discussion Forums: A Neural Architecture,10.18653/v1/N19-1318,8
Generating Token-Level Explanations for Natural Language Inference,10.18653/v1/N19-1101,8
Subword Encoding in Lattice LSTM for Chinese Word Segmentation,10.18653/v1/N19-1278,8
Adversarial Decomposition of Text Representation,10.18653/v1/N19-1088,8
Mitigating Uncertainty in Document Classification,10.18653/v1/N19-1316,8
An annotated dataset of literary entities,10.18653/v1/N19-1220,8
"Practical, Efficient, and Customizable Active Learning for Named Entity Recognition in the Digital Humanities",10.18653/v1/N19-1231,8
Consistency by Agreement in Zero-Shot Neural Machine Translation,10.18653/v1/N19-1121,8
Extract and Edit: An Alternative to Back-Translation for Unsupervised Neural Machine Translation,10.18653/v1/N19-1120,8
A Richer-but-Smarter Shortest Dependency Path with Attentive Augmentation for Relation Extraction,10.18653/v1/N19-1298,7
“Caption” as a Coherence Relation: Evidence and Implications,10.18653/v1/W19-1806,7
Structural Neural Encoders for AMR-to-text Generation,10.18653/v1/N19-1366,7
Ranking and Selecting Multi-Hop Knowledge Paths to Better Predict Human Needs,10.18653/v1/N19-1368,7
A Systematic Study of Leveraging Subword Information for Learning Word Representations,10.18653/v1/N19-1097,7
Improving Distantly-supervised Entity Typing with Compact Latent Space Clustering,10.18653/v1/N19-1294,7
Adaptive Convolution for Text Classification,10.18653/v1/N19-1256,7
Hierarchical Nested Named Entity Recognition,10.18653/v1/W19-1904,7
Deep Learning for Natural Language Inference,10.18653/v1/N19-5002,7
"Eidos, INDRA, & Delphi: From Free Text to Executable Causal Models",10.18653/v1/N19-4008,7
WiC: the Word-in-Context Dataset for Evaluating Context-Sensitive Meaning Representations,10.18653/v1/N19-1128,7
Open Information Extraction from Question-Answer Pairs,10.18653/v1/N19-1239,7
A Case Study on Neural Headline Generation for Editing Support,10.18653/v1/N19-2010,7
Development and Deployment of a Large-Scale Dialog-based Intelligent Tutoring System,10.18653/v1/N19-2015,7
Graph Pattern Entity Ranking Model for Knowledge Graph Completion,10.18653/v1/N19-1104,7
Distantly Supervised Biomedical Knowledge Acquisition via Knowledge Graph Based Attention,10.18653/v1/W19-2601,7
Fake News Detection using Deep Markov Random Fields,10.18653/v1/N19-1141,7
Improving Neural Machine Translation with Neural Syntactic Distance,10.18653/v1/N19-1205,7
Temporal Analysis of the Semantic Verbal Fluency Task in Persons with Subjective and Mild Cognitive Impairment,10.18653/v1/W19-3012,7
CLPsych2019 Shared Task: Predicting Suicide Risk Level from Reddit Posts on Multiple Forums,10.18653/v1/W19-3020,7
Similar Minds Post Alike: Assessment of Suicide Risk Using a Hybrid Model,10.18653/v1/W19-3018,7
Improving Robustness of Machine Translation with Synthetic Noise,10.18653/v1/N19-1190,7
Revisiting Adversarial Autoencoder for Unsupervised Word Translation with Cycle Consistency and Improved Training,10.18653/v1/N19-1386,7
AudioCaps: Generating Captions for Audios in The Wild,10.18653/v1/N19-1011,7
Highly Effective Arabic Diacritization using Sequence to Sequence Modeling,10.18653/v1/N19-1248,7
Semantic Role Labeling with Associated Memory Network,10.18653/v1/N19-1340,7
Continual Learning for Sentence Representations Using Conceptors,10.18653/v1/N19-1331,7
How Large a Vocabulary Does Text Classification Need? A Variational Approach to Vocabulary Selection,10.18653/v1/N19-1352,6
Simplified Neural Unsupervised Domain Adaptation,10.18653/v1/N19-1039,6
Multi-Level Memory for Task Oriented Dialogs,10.18653/v1/N19-1375,6
A Multi-Task Approach for Disentangling Syntax and Semantics in Sentence Representations,10.18653/v1/N19-1254,6
Learning to Attend On Essential Terms: An Enhanced Retriever-Reader Model for Open-domain Question Answering,10.18653/v1/N19-1030,6
How to Avoid Sentences Spelling Boring? Towards a Neural Approach to Unsupervised Metaphor Generation,10.18653/v1/N19-1092,6
Language and Dialect Identification of Cuneiform Texts,10.18653/v1/W19-1409,6
Keyphrase Generation: A Text Summarization Struggle,10.18653/v1/N19-1070,6
Learning to Decipher Hate Symbols,10.18653/v1/N19-1305,6
Structural Supervision Improves Learning of Non-Local Grammatical Dependencies,10.18653/v1/N19-1334,6
An Effective Label Noise Model for DNN Text Classification,10.18653/v1/N19-1328,6
Low-Resource Syntactic Transfer with Unsupervised Source Reordering,10.18653/v1/N19-1385,6
A Study of Incorrect Paraphrases in Crowdsourced User Utterances,10.18653/v1/N19-1026,6
Neural Vector Conceptualization for Word Vector Space Interpretation,10.18653/v1/W19-2001,6
Subword-Level Language Identification for Intra-Word Code-Switching,10.18653/v1/N19-1201,6
